2011-04-04 18:57:43.804195 IP 10.10.18.253.58297 > 10.10.18.40.3306: tcp 132
2011-04-04 18:57:43.804465 IP 10.10.18.40.3306 > 10.10.18.253.58297: tcp 2920
2011-04-04 18:57:43.804473 IP 10.10.18.40.3306 > 10.10.18.253.58297: tcp 76
2011-04-04 18:57:43.805481 IP 10.10.18.253.40135 > 10.10.18.40.3306: tcp 819
2011-04-04 18:57:43.805801 IP 10.10.18.253.52726 > 10.10.18.40.3306: tcp 183
2011-04-04 18:57:43.806003 IP 10.10.18.40.3306 > 10.10.18.253.52726: tcp 66
2011-04-04 18:57:43.806026 IP 10.10.18.40.3306 > 10.10.18.253.40135: tcp 11680
2011-04-04 18:57:43.806032 IP 10.10.18.40.3306 > 10.10.18.253.40135: tcp 340
